{
  "attempts": [
    {
      "attempt_id": "kca1_a45b955c7d302cbc43dea729d560634da97ad095bc5e52530ee735872e788d23",
      "replay_attempt": 1,
      "replay_export_input_sha256": "0000000000000000000000000000000000000000000000000000000000000050",
      "replay_task_id": "rt1_0000000000000000000000000000000000000000000000000000000000000001",
      "report_entry_sha256": "000000000000000000000000000000000000000000000000000000000000003c",
      "required_action": "run",
      "result_id": "r2_0000000000000000000000000000000000000000000000000000000000000000",
      "terminal_event_sha256": "0000000000000000000000000000000000000000000000000000000000000028",
      "terminal_verdict_sha256": "0000000000000000000000000000000000000000000000000000000000000014"
    },
    {
      "attempt_id": "kca1_997753ccc5955b5359291906244be05aae140293541f4a048f8595a6b23972fb",
      "replay_attempt": 2,
      "replay_export_input_sha256": "0000000000000000000000000000000000000000000000000000000000000051",
      "replay_task_id": "rt1_0000000000000000000000000000000000000000000000000000000000000002",
      "report_entry_sha256": "000000000000000000000000000000000000000000000000000000000000003d",
      "required_action": "run",
      "result_id": "r2_1111111111111111111111111111111111111111111111111111111111111111",
      "terminal_event_sha256": "0000000000000000000000000000000000000000000000000000000000000029",
      "terminal_verdict_sha256": "0000000000000000000000000000000000000000000000000000000000000015"
    },
    {
      "attempt_id": "kca1_49386024d3263169a9e1a4c7bd853361da195ee641400c1edbd82bc67f6e930b",
      "replay_attempt": 8,
      "replay_export_input_sha256": null,
      "replay_task_id": "rt1_0000000000000000000000000000000000000000000000000000000000000008",
      "report_entry_sha256": null,
      "required_action": "record_source_unavailable",
      "result_id": "r2_7777777777777777777777777777777777777777777777777777777777777777",
      "terminal_event_sha256": null,
      "terminal_verdict_sha256": null
    },
    {
      "attempt_id": "kca1_2da9d88277608c59960a88d7ed3145b8ceaa3078b531bb6baf7488d51ff8c76a",
      "replay_attempt": 10,
      "replay_export_input_sha256": null,
      "replay_task_id": "rt1_000000000000000000000000000000000000000000000000000000000000000a",
      "report_entry_sha256": null,
      "required_action": "record_replay_pending",
      "result_id": "r2_9999999999999999999999999999999999999999999999999999999999999999",
      "terminal_event_sha256": null,
      "terminal_verdict_sha256": null
    }
  ],
  "configuration_id": "kcc1_7c628a869a8d2794af0992dba12a6b616c2c03c47788b4daaa0b0dfecfa86528",
  "configuration_sha256": "1e8eed6839e182a140e7951074cc7466507cd4f2ea0cc1f4fa4ff9d792f0ae85",
  "inventory_id": "kci1_2fdf7932ee50d57a18c4a505b3441ddfb90f576ec3e8eabbc8829c9b11fd227d",
  "inventory_sha256": "a8cd825cfeec26df94458f94bb7b96aef7590c20c7d0180ac07c09384590662c",
  "kind": "kernel_corpus_shard_plan",
  "schema_version": 1,
  "shard_count": 1,
  "shard_id": "ksh1_90d51e79a0d97a08ed8e691ca96b9b57366763732b4d389ed88e3839c2776a10",
  "shard_index": 0
}
